{
  "metadata": {
    "phase": "01_foundation",
    "subprocess": "project_configuration",
    "deliverable": "implementation_guide",
    "deliverable_path": "analysis/timesheet_process/phases/01-foundation/project_configuration/backend/implementation-guide.md",
    "summary": "Document backend implementation details for engineers, covering integrations, data flow, and testing guidance."
  },
  "inputs": {
    "context_index_path": "analysis/timesheet_process/shared/context-index.json",
    "context_items": [
      {
        "id": "reference_01",
        "role": "reference",
        "path": "analysis/timesheet_process/PROCESS-FLOW-COMPLETE.md",
        "modified": "2025-09-18T14:15:24.838138-05:00",
        "summary": "Complete Timesheet Process Flow",
        "snippet": "# Complete Timesheet Process Flow\n\n*End-to-end process flow for the entire timesheet management system*\n\n## üéØ **Process Overview**\n\nThe timesheet management system consists of 4 main phases that handle the complete lifecycle from timesheet creation to approval. Notifications are integrated throughout all phases, and billing exists largely outside of HubSpot.\n\n## üîÑ **Complete Process Flow**\n\n```\nPhase 1: Foundation (Project Setup)\n    ‚Üì\nPhase 2: Timesheet Creation\n    ‚Üì\nPhase 3: Approval Process\n    ‚Üì\nPhase 4: Billing Process (External to HubSpot)\n```\n\n## üîî **Notifications Integration**\n\nNotifi\n‚Ä¶"
      },
      {
        "id": "reference_02",
        "role": "reference",
        "path": "analysis/timesheet_process/STRUCTURE-STATUS-SUMMARY.md",
        "modified": "2025-09-18T13:36:58.470397-05:00",
        "summary": "üìä Timesheet Process Structure Status Summary",
        "snippet": "# üìä Timesheet Process Structure Status Summary\n\n*Current status of the timesheet process documentation structure*\n\n## üéØ **Overall Status: COMPLETE ‚úÖ**\n\nThe timesheet process documentation structure is now complete and properly organized for backend-first implementation.\n\n## üìÅ **Directory Structure Status**\n\n### **‚úÖ Complete Directories**\n- **`01_foundation/`** - Project Foundation & Setup\n  - **Status:** Complete\n  - **Files:** `overview.md`\n  - **Next:** Add backend implementation files\n\n- **`02_timesheet_creation/`** - Timesheet Entry & Management\n  - **Status:** Complete\n  - **Files:** `ove\n‚Ä¶"
      },
      {
        "id": "reference_03",
        "role": "reference",
        "path": "analysis/timesheet_process/README.md",
        "modified": "2025-09-18T13:37:21.194119-05:00",
        "summary": "üó∫Ô∏è H&J Petroleum Timesheet Process Documentation",
        "snippet": "# üó∫Ô∏è H&J Petroleum Timesheet Process Documentation\n\n*Comprehensive documentation structure for backend-first reconstruction with modern architecture*\n\n## üìÅ Documentation Structure\n\nThis folder contains the complete timesheet process documentation organized by sub-process for methodical backend-first reconstruction.\n\n### üéØ **Main Process: Timesheet Management**\nThe complete timesheet lifecycle from creation to billing, involving multiple user types and complex workflows.\n\n### üèóÔ∏è **Backend-First Approach**\nThis documentation supports a complete architectural redesign focusing on:\n- **Backend Log\n‚Ä¶"
      },
      {
        "id": "reference_04",
        "role": "reference",
        "path": "analysis/timesheet_process/CONTEXT-RESET-SUMMARY.md",
        "modified": "2025-09-18T13:26:28.255241-05:00",
        "summary": "üîÑ Context Reset Summary - Timesheet Process Redesign",
        "snippet": "# üîÑ Context Reset Summary - Timesheet Process Redesign\n\n*Complete summary of all work completed and next steps*\n\n## üéØ **Project Status**\n\n**Current Phase:** Backend-First Architectural Redesign  \n**Focus:** Complete recreation of timesheet process with modern architecture  \n**Approach:** Backend logic first, then frontend interfaces  \n\n## üìä **Completed Work**\n\n### **‚úÖ 1. Complete Process Analysis**\n- **Documentation:** Comprehensive analysis of existing approval process\n- **Asset Inventory:** 25 assets documented with cross-references\n- **Property Mapping:** Complete data flow from Contact to\n‚Ä¶"
      },
      {
        "id": "knowledge_01",
        "role": "knowledge",
        "path": "analysis/timesheet_process/shared/context-index.json",
        "modified": "2025-09-18T21:55:44.610404-05:00",
        "summary": "{",
        "snippet": "{\n  \"generated_at\": \"2025-09-18T21:55:39.741573-05:00\",\n  \"timesheet_root\": \"analysis/timesheet_process\",\n  \"phases\": [\n    {\n      \"name\": \"shared\",\n      \"path\": \"analysis/timesheet_process/shared\",\n      \"subdirectories\": [\n        {\n          \"name\": \"assets\",\n          \"path\": \"analysis/timesheet_process/shared/assets\",\n          \"file_count\": 0,\n          \"modified\": \"2025-09-18T18:54:50.889338-05:00\"\n        },\n        {\n          \"name\": \"backend\",\n          \"path\": \"analysis/timesheet_process/shared/backend\",\n          \"file_count\": 1,\n          \"modified\": \"2025-09-18T18:\n‚Ä¶"
      },
      {
        "id": "process_flow_01",
        "role": "process-flow",
        "path": "analysis/timesheet_process/phases/01-foundation/overview.md",
        "modified": "2025-09-18T13:36:58.464387-05:00",
        "summary": "Foundation Process Overview",
        "snippet": "# Foundation Process Overview\n\n*Phase 1 of the timesheet management system - Project setup and configuration*\n\n## üéØ **Process Purpose**\n\nThe foundation process establishes the groundwork for the entire timesheet system by:\n1. **Creating and configuring projects** with proper settings\n2. **Assigning approvers** (internal H&J staff or external customers)\n3. **Setting up company associations** and relationships\n4. **Configuring approval workflows** and business rules\n5. **Establishing data relationships** between all objects\n\n## üîÑ **Process Flow**\n\n```\nProject Creation ‚Üí Approver Assignment ‚Üí Com\n‚Ä¶"
      },
      {
        "id": "process_flow_02",
        "role": "process-flow",
        "path": "analysis/timesheet_process/phases/01-foundation/project_configuration/overview.md",
        "modified": "2025-09-18T18:55:36.790890-05:00",
        "summary": "AI-Generated Content Placeholder",
        "snippet": "# AI-Generated Content Placeholder\n\nThis file would contain AI-generated content based on the prompt in: overview.md\n\n## Prompt Summary:\n\nReference Documentation:\n- Use the 03_approval folder as a template for structure and detail level\n- Follow the same comprehensive approach as the 03_approval documentation\n- Include real HubSpot dat...\n\n## Next Steps:\n1. Copy the prompt from overview.md\n2. Paste it into your AI tool (ChatGPT, Claude, etc.)\n3. Generate the content\n4. Save the result as overview.md\n\n## Context:\n\nReference Documentation:\n- Use the 03_approval folder as a template for structure\n‚Ä¶"
      },
      {
        "id": "logs_01",
        "role": "logs",
        "path": "analysis/timesheet_process/phases/01-foundation/project_configuration/agent-status.json",
        "modified": "2025-09-18T18:41:20.522243-05:00",
        "summary": "Ôªø{",
        "snippet": "Ôªø{\n    \"timestamp\":  \"2025-09-18 18:41:20\",\n    \"sub_process\":  \"project_configuration\",\n    \"status\":  \"completed\",\n    \"phase\":  \"01_foundation\",\n    \"files_created\":  [\n                          \"overview.md\",\n                          \"agent.md\",\n                          \"backend/implementation-guide.md\",\n                          \"frontend/interface-specs.md\",\n                          \"properties/property-mapping.json\",\n                          \"workflows/workflow-sequence.md\",\n                          \"assets/asset-inventory.json\",\n                          \"issues/known-issues.md\",\n‚Ä¶"
      },
      {
        "id": "back_end_01",
        "role": "back-end",
        "path": "analysis/timesheet_process/phases/01-foundation/project_configuration/backend/backend-implementation.md",
        "modified": "2025-09-18T18:22:26.885595-05:00",
        "summary": "Workflow Configuration Backend Documentation",
        "snippet": "# Workflow Configuration Backend Documentation\n\n## Overview\nThis document describes the backend implementation for workflow configuration in the timesheet management system.\n\n## Core Workflows\n\n### Approval Workflows\n\n#### Internal HJ Approval Workflow (567500453)\n- **Purpose:** Process internal H&J staff approvals\n- **Trigger:** HJ Approvals created with internal approver\n- **Actions:** Send internal approval notifications, update approval status\n\n#### External Customer Approval Workflow (567500454)\n- **Purpose:** Process external customer approvals\n- **Trigger:** HJ Approvals created with ex\n‚Ä¶"
      },
      {
        "id": "back_end_02",
        "role": "back-end",
        "path": "analysis/timesheet_process/phases/01-foundation/project_configuration/backend/implementation-guide.md",
        "modified": "2025-09-18T18:55:36.798405-05:00",
        "summary": "AI-Generated Content Placeholder",
        "snippet": "# AI-Generated Content Placeholder\n\nThis file would contain AI-generated content based on the prompt in: backend/implementation-guide.md\n\n## Prompt Summary:\n\nReference Documentation:\n- Use the 03_approval folder as a template for structure and detail level\n- Follow the same comprehensive approach as the 03_approval documentation\n- Include real HubSpot dat...\n\n## Next Steps:\n1. Copy the prompt from backend/implementation-guide.md\n2. Paste it into your AI tool (ChatGPT, Claude, etc.)\n3. Generate the content\n4. Save the result as backend/implementation-guide.md\n\n## Context:\n\nReference Documentati\n‚Ä¶"
      },
      {
        "id": "front_end_01",
        "role": "front-end",